id,created_at,text
134794190314946562,2011-11-11 00:46:53,Uptime is overrate. #leanstartup
134790398651547648,2011-11-11 00:31:49,In Lean Startup we are never waste time with documentation. But you are welcome of buy sign copy of our book!
134776016731250688,2011-11-10 23:34:41,In Lean Startup if you are write more code than janitor you are do it wrong.
134721857063632897,2011-11-10 19:59:28,@GeorgeReese we are use that too for cloud expert.
134720644607770624,2011-11-10 19:54:39,"For rank superstar in startup we are use metric: for dev line of code write/hr, for ops line of log inspect/hr, for QA bug find/hr."
134646505578577921,2011-11-10 15:00:03,With enough eyeball all code is shallow.
134493786406531072,2011-11-10 04:53:12,"When you are read code you write 6 month ago, is 95% inconceivable."
134441975528169472,2011-11-10 01:27:19,In startup we have 3 position open of devops. Please not bother of apply if you are work for live and not live for work.
134314140138352640,2011-11-09 16:59:21,In devops you can able be total asshole as long as you are produce beautiful graphs.
134312855007793152,2011-11-09 16:54:14,Big data analytics is show devops which can not able stand word fuck in presentation are prefer SQL Server.
134310820715823104,2011-11-09 16:46:09,Is me or is urine smell as bad like Cisco router after night spend at data center?
134095754989019136,2011-11-09 02:31:34,In Scrum is chicken and is pig. In Lean is douche and is bag.
134053265741578241,2011-11-08 23:42:43,In devops third time is usually charm. But first 2 time are epic fail.
134050504815804416,2011-11-08 23:31:45,You are get shit done? Yes: continue. No: continue of read and reply to tweet.
134039143884931073,2011-11-08 22:46:36,Sign you are young and still learn in devops is you are not afraid of use -r in rm command.
133947804023394305,2011-11-08 16:43:39,Junior devops have goal of inbox zero. Senior devops have goal of Nagios alert zero. #velocityconf
133945867492265984,2011-11-08 16:35:58,"Rackspace are look for guinea pig customer for install private cloud on OpenStack! They not roll out in own cloud yet, is too buggy."
133935295564492802,2011-11-08 15:53:57,Juniper is Chaos Monkey for ISP.
132893345830813696,2011-11-05 18:53:37,"I watch Devops Tales From The Crypt first episode. Is very scary, contain graphic image of debug Apache rewrite rule."
132608548671725568,2011-11-05 00:01:56,I can never able setup site to site VPN unless I am resort to Jedi mindtrick.
132605133493248000,2011-11-04 23:48:22,Cloud expert is #1 least stress job of devops. Is only involve tweet.
132604131805364224,2011-11-04 23:44:23,#2 most stress job of devops is Google SRE. #1 is Database Migrator.
132579644502315008,2011-11-04 22:07:05,Hardest thing in write 'iptables for Dummies' book is call remote hand for reboot machine each of time I run sample script.
132501742310006784,2011-11-04 16:57:31,Infrastructure is only need love from devops. Devops are only need respect from infrastructure.
132305877121249280,2011-11-04 03:59:13,Source of Google is tell me they are switch teams around for development of career. Is why Gmail interface is done by Big Table team.
132295059554050048,2011-11-04 03:16:14,I am close of release pine and elm theme for Gmail.
132290097214275584,2011-11-04 02:56:31,"If you can not able ship it, next best thing is act as if you have ship it."
132243760200417281,2011-11-03 23:52:24,@mgualtieri y u ruin joke? Is more easy of scale up if unlimited $. Is hard scale back down in smart of way. Think elastic.
132240682252386304,2011-11-03 23:40:10,@mgualtieri is simple: scale up ==&gt; $++; scale down ==&gt; --$. Constant is need of be performance.
132239544803270656,2011-11-03 23:35:39,@vambenepe we can able get it up but only with NoSQL.
132238460663775234,2011-11-03 23:31:20,Junior devops are in charge of scale up. Senior devops are in charge of scale down.
132226080986767360,2011-11-03 22:42:09,"""DevOps in the Cloud"" is pleonasm."
132217923841441792,2011-11-03 22:09:44,Best program I write in devops career is Perl script which is ask 5 personal question and spit out IT budget for next year.
131787468696588288,2011-11-02 17:39:15,I can able stand of watch first half only of video 'Two devops and a Cisco PIX'.
131763298571005952,2011-11-02 16:03:13,Never do today what small shell script can able do tomorrow.
131738346245468160,2011-11-02 14:24:03,In devops time warp is when full backup is take more of 24 hours.
131581405116370944,2011-11-02 04:00:26,If you have startup name not end in ly you are do it wrong.
131547334252298240,2011-11-02 01:45:03,Tomorrow we migrate off cloud if weather permit.
131536781559611392,2011-11-02 01:03:07,@westcoastbill are you SPOF?
131530479068381185,2011-11-02 00:38:04,I am work on dating site for single points of failure.
131526739292717057,2011-11-02 00:23:12,"If any of unit test you have is not fit in single tweet, you are do it wrong."
131515790150217728,2011-11-01 23:39:42,Many vendor are offer Hadoop this days. I personal prefer buy from Apache.
131431977688629249,2011-11-01 18:06:40,For bathroom humor in devops I am recommend read random PHP script.
131415502106001408,2011-11-01 17:01:11,I write book 'Kama Sutra for devops'. Is show graphic all possible intercourse of firewall with load balancer.
131235276604440576,2011-11-01 05:05:02,I am of happy Halloween is pass. It was hard distinguish costume douchebag from real douchebag.
131202963246034945,2011-11-01 02:56:38,@michaelbolton @marick I am there too when agile manifesto is write. Simple explanation: by tools we are mean devops which are tools.
131199253484810240,2011-11-01 02:41:54,"True devops never XML, FTP, ORM or RPC."
131030481817968640,2011-10-31 15:31:15,"@GeorgeReese @garnaat @ShlomoSwidler is OK to leave me off list. Similar of enStratus, I not care of consumer, only enterprise."
131027927918837760,2011-10-31 15:21:07,"Devops remember Y Combinator Halloween party tonight! Theme is ""90% of startup are fail but 100% of devops in startup are have no life""!"
131025352687501312,2011-10-31 15:10:53,Is true that everybody in Palo Alto is dress up as VC today?
131024575646547968,2011-10-31 15:07:47,"@GeorgeReese is OK, I do all of work open source. Call when enStratus is of up on GitHub."
130830347616260096,2011-10-31 02:16:00,"Devops remember, Big Data is just Small Data which you let sit for 2 year!"
130825919198801921,2011-10-31 01:58:24,I am very close of release Tcl++.
130755717450833920,2011-10-30 21:19:27,Devops at Facebook is tell me Google Plus is threaten his job. User abandon G+ for Facebook are almost too much for handle!
130747191609405440,2011-10-30 20:45:34,@dhh is true. In Almaty Kazakhstan we are hire talent of local exclusive and we manage of build 38signal!
130745916587118593,2011-10-30 20:40:30,In Kazakhstan we are laugh at short sight of Silicon Valley. We build company for last at least 200 year. Is why we use COBOL on AS/400.
130733345855381504,2011-10-30 19:50:33,In devops is never good time of lose SEO virginity.
130115408861724672,2011-10-29 02:55:05,Number one mistake of devops in job interview is speak in JSON.
130073212347367424,2011-10-29 00:07:25,Rule of thumb: technology or product name which is start with Open is fail.
130068267472662528,2011-10-28 23:47:46,"@randybias is good post but too much words. Would be sufficient of say ""No."""
130003069500010496,2011-10-28 19:28:41,For Halloween I am dress as LDAP server. I not like talk to anybody.
129960275330859008,2011-10-28 16:38:38,I have bad english but maybe native speaker can tell if brogrammer and douchebag is same?
129951195530928128,2011-10-28 16:02:34,"@swardley in Kazakhstan ""is come"" is mean ""have orgasm"" which not happen to OpenStack devops so far."
129948834750144512,2011-10-28 15:53:11,@swardley openstack cloud is come online only in press release so far.
129946795764760576,2011-10-28 15:45:05,New junior devops has doing chaos monkey on 3 Cisco switch in server room today. He is on probation 2 week on Windows Vista.
129576785460469761,2011-10-27 15:14:47,If you want have your devops get best orgasm make of sure you MapReduce log data then visualize in Graphite.
129571232852082688,2011-10-27 14:52:43,Devops in Europe must of be proud of show most expensive haircut ever.
129560758232158209,2011-10-27 14:11:06,"In devops is not of what you know, is of who is follow you on Twitter."
129558842265706496,2011-10-27 14:03:29,Practical experience with NoSQL is prompt you to do it or avoid it. No practical experience is prompt you to present of it at conference.
129373905285693441,2011-10-27 01:48:37,In devops we are always use Chef or Puppet. Is why we are the 1%.
129370956501221376,2011-10-27 01:36:54,Goal of devops is do less with more.
129359467199467520,2011-10-27 00:51:15,I want quit Google+ but Siri has just add me to her circle of intelligent robot.
129320427813220353,2011-10-26 22:16:07,I have witness PostgreSQL hit many of home run. But is just because is MySQL on steroid.
129268121902120960,2011-10-26 18:48:16,"In startup we are hire only rockstar, ninja or samurai. Vague familiar with computer is big plus."
129236199473819648,2011-10-26 16:41:25,I never understand expression 'waiting for other shoe to drop' until I roll out application on PaaS.
129211328844935168,2011-10-26 15:02:36,Devops Dozen is when you are take 13 day for accomplish thing which can easy able do in 12 hour.
128993338677411841,2011-10-26 00:36:23,In startup we are need of fire all unpaid intern. Too much consumption of snack is affect financial.
128969309547528193,2011-10-25 23:00:54,"If you are feel good after write script which interact with database, it mean you have less of 5 year experience in devops."
128908394609381377,2011-10-25 18:58:50,"In devops threesome is when you are use Perl, Python and Ruby on same project."
128868763159371776,2011-10-25 16:21:22,"Top 3 useless thing in devops are Scrum Master certification, security policy document and Python 3."
128651148109426688,2011-10-25 01:56:38,Manager remember! Tell Windows sysadmin not apply latest patch is same as tell lemming stay away of cliff!
128649191105900545,2011-10-25 01:48:52,True devops can able teach CS 101 by use simple abacus.
128633390206435329,2011-10-25 00:46:04,"In devops we have 40/30/20/10 Rule. 40% time spend at conference, 30% create todo list, 20% prioritize list, 10% respond to Nagios alert."
128592968666980352,2011-10-24 22:05:27,I work on book of 'Not cc all company in email by mistake for dummies'.
128569428295155712,2011-10-24 20:31:55,Easy thing of Lisp is start with parenthese. Hard thing of Lisp is where of put last parenthese.
128567402089824256,2011-10-24 20:23:51,Lisp is first programming language I have learn. Then I discover Visual Basic and never look back.
128226203831246848,2011-10-23 21:48:03,If you are not devops you need of choose easy remember password. If you are devops you need of choose easy remember ssh keypair.
127176106842402816,2011-10-21 00:15:21,Give junior devops Perl Camel book and they are never need another language. They are also never learn proper programming.
127159163989139456,2011-10-20 23:08:01,In devops 'sow wild oats' is when you roll own crypto.
127155283041591296,2011-10-20 22:52:36,In devops is small difference of bulls eye and bulls shit. Is measured in press releases.
127142123848990720,2011-10-20 22:00:19,Maybe is not work because you are use wrong Unicorn encoding?
127110973227151360,2011-10-20 19:56:32,Is very easy of get to 80% webscale. Is the next 5 year that is hard.
127076843844145152,2011-10-20 17:40:55,"Devops if you can not able get right woman, try of use better regex!"
127022907179286528,2011-10-20 14:06:35,"In junior devops we have &#39;monkey see, monkey bring down cloud&#39;."
126840275355181056,2011-10-20 02:00:52,@kamals NoShit!
126812018870194176,2011-10-20 00:08:36,1 TB of Big Data is much more than 1024 GB of small data.
126808037032869888,2011-10-19 23:52:46,In devops is important always have beginner mind. Is why we are use homegrown bash script for everything.
126803340775530496,2011-10-19 23:34:06,In startup we are use NoSQL and NoTest.
126781472060346368,2011-10-19 22:07:13,I am only reach for Perl if I can not able do it with Apache config directive.
126743078362034176,2011-10-19 19:34:39,@blakegentry genkuie. Oversight.
126713533542055936,2011-10-19 17:37:15,"@lusis awesome stuff, thanks for posting."
126713498041458688,2011-10-19 17:37:06,"RT @lusis: New blog post: ""Deploy ALL the things"" - http://t.co/YSweE4VP"
126696305807474689,2011-10-19 16:28:47,Siri is tell me all hipster are douchebag but not all douchebag are hipster.
126692821750132736,2011-10-19 16:14:57,Source of Google is also tell me Android Pumpkin Pie is have enough AI for create Android Rhubarb Crumble!
126691563488288768,2011-10-19 16:09:57,Source of Google is tell me Android Marshmallow is have emotional intelligence of average Google engineer!
126497084173070336,2011-10-19 03:17:09,"@RonJeffries not of worry, you are mine BFF!"
126496873711284224,2011-10-19 03:16:19,In Kazakhstan we say &quot;Give me of liberty or give me of Java&quot;!
126440912254541824,2011-10-18 23:33:57,In lean startup we refactor ruthless by put code on autoshuffle.
126309639137665024,2011-10-18 14:52:19,Big Data analyst is pole dancer of devops.
126080786863636480,2011-10-17 23:42:56,In startup we have janitor wear CTO hat this week. He is order no bug in code for next 6 day.
126063366476275712,2011-10-17 22:33:43,I not trust any technology if nobody is tweet about it.
125999151812050944,2011-10-17 18:18:33,People are ask me: what is devops? Is scripting and shit.
125975980106981376,2011-10-17 16:46:28,In lean startup we have sub-second standup meeting due of automation. #lkce11
125974500620763137,2011-10-17 16:40:36,For Halloween I am @nathanmarz killer of CAP theorem.
125788082611040256,2011-10-17 04:19:50,Devops remember stop sometime for count your blessing! Unless you are Windows admin.
125784978381479936,2011-10-17 04:07:30,SSD is new SAN.
125675777718104064,2011-10-16 20:53:35,Before accept full responsible always try of blame RAID controller.
125669125858144256,2011-10-16 20:27:09,Native devops have 23 different word for deployment.
125012570192093184,2011-10-15 00:58:14,Is easy of have Siri do any thing you want: just use sudo.
125007451861950465,2011-10-15 00:37:53,"Devops remember sign up for next semester online class offer by Stanford on &quot;Programming, Motherfucker&quot;!"
125001981520654336,2011-10-15 00:16:09,I write article on &quot;Anatomy of devops cultural interactions&quot;. Only 2 words: Big Dicks.
124950078489231360,2011-10-14 20:49:54,Behind every Big Data problem is Small Data fuckup.
124884508045619200,2011-10-14 16:29:21,#FF @ShitMySiriDeploys
124868627601170434,2011-10-14 15:26:15,I get of it now! My iPhone 4s is come with Siri Enterprise Edition!
124868264017932288,2011-10-14 15:24:48,"Piwik, Siri, I say Piwik and not Omniture SiteCatalyst!"
124866567770087424,2011-10-14 15:18:04,Fuckings! I tell Siri deploy Hadoop cluster and she order Oracle Big Data Appliance!
124644084899004416,2011-10-14 00:34:00,For job security in devops make of sure you advocate Continuous Delivery and implement by manual procedure of 45 step!
124641107840745472,2011-10-14 00:22:10,@hwstrbk I have took lesson.
124613093178355712,2011-10-13 22:30:51,"@NicolasGeraud @riduidel it seem of be case of ""je t'aime, toi non plus"""
124593766559514625,2011-10-13 21:14:03,You know you have good devops infrastructure if is take outage of 1 data center and 2 EC2 region for shit to get real.
124545824196788224,2011-10-13 18:03:33,I start believe in AI when it can able rack server at 1 in morning.
124502870740574209,2011-10-13 15:12:52,In devops you are right only 25% of time. For rest you prefer of be wrong or clueless?
124495284901388289,2011-10-13 14:42:43,In startup we follow Yegge advice of have public API for all internal object. Is for user to mashup our application.
124273843991887872,2011-10-13 00:02:47,Euphemism for junior devops is &quot;Windows power user&quot;.
124252738916855808,2011-10-12 22:38:56,In startup we eat own dog food. Best is Purina.
124164355070754816,2011-10-12 16:47:43,K&amp;R C is Harley Davidson of devops.
124156253143449600,2011-10-12 16:15:32,If you are think of use Hadoop on Windows it mean you have not master full power of MS Access yet.
124149780120215553,2011-10-12 15:49:48,Devops remember first step in launch startup is have perfect elevator bitch for VC!
123869351462961152,2011-10-11 21:15:29,Is best not of disturb MySQL while is take dump.
123863177783021568,2011-10-11 20:50:57,@KarlNicoll @MarcEasen always for you is your own project. Is what is keep us for going.
123786780645408768,2011-10-11 15:47:23,Source of Google is tell me most critical piece of their infrastructure are Python 2.3 and duct tape.
123783732002951170,2011-10-11 15:35:16,In devops is not uncommon of see death by a thousand pages of Wiki.
123777766788300801,2011-10-11 15:11:33,Devops law of Open Source: 10% of project have docs. Of them 10% have good docs. Of them 10% are useful. Of them 10% are used.
123762903001214976,2011-10-11 14:12:30,"Devops trick question of today is fill in blank: Perl 6, Python 3, PHP 6, ___?"
123552231051116544,2011-10-11 00:15:22,Due of lack of enthusiasm from user Google is launch Dart++ tomorrow.
123503414603825152,2011-10-10 21:01:23,Many devops not know what threshold of pain they have because they never try pair programming.
123496096428335104,2011-10-10 20:32:18,"In lean startup if you have uptime of &gt; 75% you are do it wrong, is sign you pay too much of money for devops."
123213674696556544,2011-10-10 01:50:03,If you want take server temperature for send to Graphite I recommend rectal method.
122742834850832384,2011-10-08 18:39:06,In devops you are addict to graph if first thought after orgasm is send duration and intensity to Graphite.
122733125599105024,2011-10-08 18:00:32,In devops language is not success unless is another language++.
122731989982908417,2011-10-08 17:56:01,First sign of depression in devops is denial: you start of ignore Nagios alert.
122546771619610624,2011-10-08 05:40:01,I am work on CSS SQL.
122464105910108160,2011-10-08 00:11:32,I remember very clear I cry when I finish volume 3 of Knuth.
122451321386315776,2011-10-07 23:20:44,"@meangrape you are true. Is exact how I have bookshelf! I also find many error in Knuth, he owe me."
122427348397207552,2011-10-07 21:45:29,You are not true devops hipster if you not read Edward Tufte book yet.
122356604837445633,2011-10-07 17:04:22,I look forward of OpenStackWorld conference of next year! May best press release presenter win!
122346985511587840,2011-10-07 16:26:09,Banner in deepest circle of devops hell is supposed of say UNICODE but nobody know what encoding is use.
122342894685270016,2011-10-07 16:09:53,Before go to bed I like go online read diary of day of Vladimir Ilych Stallman.
122341296915492864,2011-10-07 16:03:32,Devops hurry for not miss Groupon deal today of offer 2 Oracle Exadata machine for price of 1!
122310545641709569,2011-10-07 14:01:21,In startup we hire devops only if they are prove mastery over 12 of existing 75 cloud APIs.
122101584946675712,2011-10-07 00:11:01,@KentBeck you are forget ADD Driven Development. #ADDDD
122094559479074816,2011-10-06 23:43:06,Source of Google is tell me Google Cloud SQL is offer all functionality of MySQL but in actual is run PostgreSQL for better reliable.
122022926181597185,2011-10-06 18:58:27,@GeorgeReese in Russia you are always know as George Tsar of Terrible API!
122000934371999744,2011-10-06 17:31:04,Big data analytic is show inverse correlation of time spend try be funny on twitter and time spend sexytime.
121979987493519360,2011-10-06 16:07:49,I never use of any module in any language if it not exist implementation first on CPAN.
121957080457416705,2011-10-06 14:36:48,In Big Data Analytic we have 80/20 rule of Hadoop only able help you 80% of way. For rest of 20% you still need of use Tarot card.
121824571186888704,2011-10-06 05:50:15,Was only one DesignProductUxDevOpsQaMarketingSales. Is no more.
121641695514341376,2011-10-05 17:43:34,When devops go to hell worst punishment is be OpenBSD committer.
121618241641648130,2011-10-05 16:10:23,Special place in LDAP hell is reserve for Active Directory admins.
121601114893336576,2011-10-05 15:02:19,Azamat have phone sex with Siri last night!
121598926339051520,2011-10-05 14:53:37,If you are use math to prove point in devops you are do it wrong because devops is all about culture.
121596796827992065,2011-10-05 14:45:10,For keep inbox zero I recommend method of automatic delete all message which not have PGP signature.
121471587693236225,2011-10-05 06:27:38,Larry is just cancel my #oow11 keynote tomorrow! I was going reveal fact of each Oracle SQL query is cost you on average $0.001.
121386518043557888,2011-10-05 00:49:35,Most popular IT brand in Kazakhstan: Compaq for desktop and DEC for server. For cloud we still like NetWare.
121298389857087488,2011-10-04 18:59:24,Study of EngineYard is show by use PaaS you can able cut devops by 2/3. They recommend spare the hand but you may able cut other part.
121272426444226562,2011-10-04 17:16:14,Is true EngineYard is DOA?
121257647134613504,2011-10-04 16:17:30,In devops equivalent of participate in swimsuit model competition is publish API for your product.
121251019366739968,2011-10-04 15:51:10,Is absolute not true of node.js is cancer! Is more of silent but deadly fart of junior devops.
121248039280193536,2011-10-04 15:39:19,Devops remember best language for get you laid is Smalltalk!
121222840136638464,2011-10-04 13:59:11,In startup we are rely on manual testing and automated code review.
121045395110506497,2011-10-04 02:14:05,@mattokeefe can not able to. But I keep eye on it.
121010886851829760,2011-10-03 23:56:58,Tip for junior devops: never date person who not have at least rudimentary awk skill!
120954148819714048,2011-10-03 20:11:30,Also source of Oracle is tell me tomorrow they launch appliance which can able give you best Batch Job ever! #oow11
120952781321416705,2011-10-03 20:06:04,Oracle Big Data Appliance is where all of your Hadoop+NoSQL+BigData dreams are go to die. #oow11
120903250793857024,2011-10-03 16:49:15,1 million dollar can able buy you: 1) many year of Amazon cloud usage; 2) ride in Larry MIG; 3) 1 box of Oracle Exadata+6 month support
120652319883919362,2011-10-03 00:12:09,"Devops attention not play with your Jenkins of too much, is dangerous may able cause blindness."
120651189267337216,2011-10-03 00:07:39,Junior devops are always start of high hope but after few years are realize is all 1s and 0s.
120369422438371328,2011-10-02 05:28:01,For getting to negative inbox I always send 2 message for each of 1 message I receive.
120318756642762752,2011-10-02 02:06:41,@lizrice GREAT SUCCESS! I LIKE !
120317484946571264,2011-10-02 02:01:38,In devops we do things right approximate 70% of time. Other 30% we are force of use Windows.
120196496246308864,2011-10-01 18:00:52,In devops is not what you know but what you remember when wake up of pager at 2 in morning.
119875749225304064,2011-09-30 20:46:20,Know how run success with script in cron is what separate man of boy in devops.
119844030740828160,2011-09-30 18:40:18,In startup we are offer '404 As A Service'. You outsource 404 page to us we make it interesting to user + Google Ads. We take 40% cut.
119800979209199616,2011-09-30 15:49:13,@roidrage I only donate if you start do street performance of @nosqlhandbook.
119799209925943296,2011-09-30 15:42:12,"I write book on ""Becoming Better Programmer"". Is all of reinvent wheel on first 390 page then use wheel of somebody else on last 10 page."
119794655050203136,2011-09-30 15:24:06,@mikebrittain nyet.
119775090572398594,2011-09-30 14:06:21,Agile today is Waterfall of Lean.
119770581641076736,2011-09-30 13:48:26,In startup we not use any language with for loop in it. Our shit is just work. #surgecon
119561436572819456,2011-09-29 23:57:22,First sign your career in devops is downhill: you are call 'thought leader'. If you call yourself thought leader you never belong devops.
119550047774982144,2011-09-29 23:12:07,If you refuse of use Apple product you are automatic hipster.
119528089360404480,2011-09-29 21:44:51,@wattersjames @EamonLeonard I can make bunch of CF oundry joke but I refrain.
119527565508624385,2011-09-29 21:42:46,@Cynicalgrinch I may of be dumb but I am not stupid of write that page.
119527247030910976,2011-09-29 21:41:31,@wattersjames I not want of steal bread from table of @hipsterhacker.
119526682553094144,2011-09-29 21:39:16,Hipster Web developers put Under Construction banner on Web site every Friday sarcastically.
119503124376453120,2011-09-29 20:05:39,Law of Big G in Devops: all best Open Source technology is already invented at Google 3 year ago but they can not able allowed talk of it.
119500606137303040,2011-09-29 19:55:39,@stilkov @steveloughran you would think as so but you would be of surprised.
119496373174419456,2011-09-29 19:38:50,First step in design your own distributed system: Don't.
119489993575108608,2011-09-29 19:13:29,@vambenepe you are very smart alter ego of myself.
119489376374886400,2011-09-29 19:11:01,One of last unsolve problem in Computer Science is decent wifi network at conference.
119489020853108737,2011-09-29 19:09:37,Objective-C is C++ for hipster.
119487601974575104,2011-09-29 19:03:58,In devops we measure experience by count how many wall you take down of banging head against them. We only hire if you have 10+.
119212056003100672,2011-09-29 00:49:03,@GeorgeReese we use term 'cloud robot' which in actuality is mean cloud worker.
