id,created_at,text
52738340620992512,2011-03-29 14:26:14,@dozba you are true. Same for ebay and paypal.
52737470802038784,2011-03-29 14:22:47,@swardley @JoeBaguley in Kazakhstan we give refrigerator not certificate to cloud expert. Is for horse meat.
52730963301646336,2011-03-29 13:56:56,I send Azamat to U S and A for learn Dev from @zedshaw and Ops from @dozba. First task is learn curse word of America.
52527801374478336,2011-03-29 00:29:38,"@swardley not worry, you create list so you are on metadata of list! Azamat say you are always #1 in heart of him!"
52525324596035584,2011-03-29 00:19:47,@swardley I admit I am charlatan in personally! Which are you?
52523858640650240,2011-03-29 00:13:58,"In startup we ask question in interview for devops: ""You use Windows at any time?"" We assure candidate of answer is strict confidential."
52169317483159552,2011-03-28 00:45:09,@krishnan please consider of change word Cloud with Compute Utility across of your story. /cc @swardley
51867658022428674,2011-03-27 04:46:27,Every weekend in startup we let servers catch breath by send all log to /dev/null. Performance during week is improve by 20%!
51865551798157313,2011-03-27 04:38:05,"After try 5 SQL and 8 NoSQL product, Azamat is still search for database. Requirement is not even hard! Is must only have C, A and P."
51448555877048320,2011-03-26 01:01:06,"I am try prove ""Microsoft technology is scale at infinite"" by induction. Prove of N =&gt; N+1 is very easy. Only problem is N=1 keep do BSOD."
51337145897598976,2011-03-25 17:38:24,"@nnmiller in that case is no project to speak of, so no failure!"
51332043161870336,2011-03-25 17:18:07,"Is correlation between word use by devops and project failure rate: ""async"", ""continuous"", ""eventual"", ""RoR"", ""PaaS"", ""socket"", ""elastic"""
51324117521141760,2011-03-25 16:46:37,"Azamat is run Big Data analytics on famous last words in devops. Most common is ""I know, I roll own monitoring tool!"""
51120581495623680,2011-03-25 03:17:51,In startup we have shock offer from @color. They want buy us for 39 million U S Dollar! Good thing CEO not want sell out so cheap.
51117649907810305,2011-03-25 03:06:12,"Advice of Azamat: if want DevOps culture, make of sure not hire Ninja Dev and Pirate Ops!"
51111740963954690,2011-03-25 02:42:43,@pcapr Azamat like! Only observation is try use Perl one-liner more often instead of Ruby!
51028266303238144,2011-03-24 21:11:01,You can able pop hood open? Is DevOps. You can not able? Is NoOps.
50948942493519873,2011-03-24 15:55:49,In startup we are work on 5GL language. We estimate go full #NoDev in Q4 2011.
50943291537100800,2011-03-24 15:33:21,"Was not as easy as it sound, but Azamat final manage replace himself with Perl one-liner! Now he is look for job. #NoOps"
50781062145638400,2011-03-24 04:48:43,"If ops do dev, user may find serious bug on Web site! If devs do ops, is no Web site for user to find bug!"
50650438571266048,2011-03-23 20:09:40,"Azamat is run Hadoop analytics on tweet mention of myself. Interesting fact: if you live in NZ, UK or AU is great chance you hate my joke!"
50610229649481729,2011-03-23 17:29:53,"@daveasprey is great of read you start work on cloud infrastructure in 1998! If judge by rest of post, you stop in 2002 yes?"
50592618559717376,2011-03-23 16:19:54,In devops before we can able blog we need of write own blog engine in own Web framework on top of own HTTP server.
50588114720260096,2011-03-23 16:02:01,"@ripienaar @kit_plummer when say 'we', you mean ""the needed #devops cultural movement""? I am agree!"
50403801835909120,2011-03-23 03:49:37,Azamat suffer of devops castration anxiety. He is afraid of lose root privilege.
50392797085319168,2011-03-23 03:05:53,Source at Mozilla is tell me they were able produce only 4 million Firefox 4 browser so hurry if you want download!
50338611618525184,2011-03-22 23:30:34,In devops we live dangerous. We can be replace at any time with small script!
50301696060047360,2011-03-22 21:03:53,Great success today! We manage double capacity of public cloud in Almaty Kazakhstan. Is true saying go from 1 to 2 instance is hardest!
50042971411857408,2011-03-22 03:55:48,@fujin_ why you so angry?
50020755643174913,2011-03-22 02:27:32,Behind every great devops guy is rejection from hot woman.
49984102320971776,2011-03-22 00:01:53,Azamat is pine for days when men were men and wrote own device driver. Cloud is slow transform men in wimp!
49975134987100160,2011-03-21 23:26:15,@wattersjames is very hard break in top 10 cloud expert. Condition include attend 35 conference per year and be in photo with 5 of other 9.
49972489564069888,2011-03-21 23:15:44,@botchagalupe guy who wrote NoOps post is very confuse. With better command of English language he could be cloud expert (PaaS only).
49923582687588352,2011-03-21 20:01:24,"In devops if shit is not hit fan at least one time each week, it mean you are not try very hard."
49860784276254720,2011-03-21 15:51:51,Is true ignorance is bliss but in devops it mean Nagios server is down.
49626495827718144,2011-03-21 00:20:53,"Tolstoy's Law of Devops: ""Happy server are all alike. Unhappy server are each unhappy in own way"". Is why need Ganglia!"
49616086752169984,2011-03-20 23:39:31,"Tire of identical server from automated deployment? In startup we offer hand craft server! Is expensive, slow,buggy but is custom for you!"
49602492966776832,2011-03-20 22:45:30,In startup we are tell each server one with most alert is eliminate. Is result in very good reliability and performance!
49560058064932864,2011-03-20 19:56:53,@swardley I not trust any web site with name start with pee.
49206383421292544,2011-03-19 20:31:30,"Azamat is offer node.js training. Bring laptop. Make of sure you take out hard drive, no disk I/O involved."
49191517503488000,2011-03-19 19:32:26,Good devops as Azamat is able scale Web farm by 25% in instant! Just send 25% HTTP request to /dev/null.
49185257450258432,2011-03-19 19:07:33,"You can not able choose of create Web product or enterprise product? Is easy! In first case Google is buy you, in 2nd case Oracle."
48912450736754689,2011-03-19 01:03:31,@mramos29 is 1% inspiration and 99% transpiration. Data center in Kazakhstan not have A/C.
48909400563400704,2011-03-19 00:51:24,"In cloud each VM is compete hard with all others, or at least is die trying."
48903872755937280,2011-03-19 00:29:26,In startup we roll out infrastructure in RAIC 5 across minimum 3 Cloud provider. 100.0000001% uptime.
48898528168251392,2011-03-19 00:08:12,Is only top 10 cloud expert in world that can able put BS in EBS.
48897258648903680,2011-03-19 00:03:09,"@wattersjames in Kazakhstan public cloud is network very predictable: 0% packet loss inside, 100% outside. Is vCloud of same?"
48857374412378112,2011-03-18 21:24:40,"For disk I/O, if you can not able beat them, join them! (in RAID 0)"
48786492797100032,2011-03-18 16:43:00,Azamat is finish CISSP today. Tomorrow he is already start practice most important lesson: disable telnet on all server!
48782918805495808,2011-03-18 16:28:48,Cloud expert remember: not attempt actual buildout of infrastructure or you are disqualified! Talk at conference allowed.
48780759766544385,2011-03-18 16:20:14,Everybody is bash the cloud of lately. In startup we refuse do it!  We prefer zsh.
48610419643924480,2011-03-18 05:03:21,@mccrory @adrianco @beaker Azamat is very good at security by obscurity. He has method of random change cloud API for confuse hacker.
48603740051218432,2011-03-18 04:36:49,"You have cloud issue? Apply method of 5 Whys, then find human who misconfigured router."
48573495805878272,2011-03-18 02:36:38,Art of devops war: disable engineer on pager and you disable whole infrastructure.
48456710360281088,2011-03-17 18:52:34,"Is easy come up good name scheme. For app server we use Mike,Mikusya,Mikus,Mikusik,Mikushenka,Mikulya,Mikusha, Mikushka,Mikushenka,Mikochka"
48419784014036992,2011-03-17 16:25:50,For Saint Patrick feast in startup we paint all our Tomcats in green.
48407648932069376,2011-03-17 15:37:37,Devops: key signing party Saturday in Almaty Kazakhstan! We not only sign PGP but private SSH and SSL key too! You also get offsite backup!
48221567171313665,2011-03-17 03:18:12,@littleidea if contest is take place west of Moscow then is weak.
48209980771401728,2011-03-17 02:32:09,@adrianco please consider CTO position at Almaty startup. You have chance of order Azamat around! Pay not good but we are party all time.
48200251684831233,2011-03-17 01:53:30,"When in doubt, denormalize. When doubt is gone, normalize back."
48079852829552642,2011-03-16 17:55:04,Azamat is back from Sex by Southwest conference.
48066671956590592,2011-03-16 17:02:42,@DrPrettyBad all of above.
48065317867503616,2011-03-16 16:57:19,There is no DevOps. Is DevQaOps or DevOpsQa or OpsQaDev or OpsDevQa or QaDevOps or QaOpsDev. Perfect balance is 50/30/20.
48046673234112512,2011-03-16 15:43:14,"In startup we have opening for 1 junior devops. Requirement in-depth knowledge of BGP, Lisp and Dynamo."
47818133720936448,2011-03-16 00:35:06,In startup we practice Continuous Coding in 3 shift of 8 hour. Is base on observation that quality is able only come out of quantity.
47777632858804224,2011-03-15 21:54:09,Career advice for devops: avoid technology if is based on acronym! Only safe bet is HTTPS and SSH.
47767287889014784,2011-03-15 21:13:03,"Devops remember, world is not perfect! Otherwise we would have Perl 6, VMWare public cloud and working NoSQL!"
47747317910085632,2011-03-15 19:53:42,"In startup we need cut cost at all time. For database as example we not call commit so we save on CPU load, disk I/O and network traffic."
47745839602470912,2011-03-15 19:47:49,Continuous deployment is to deployment what trainwreck is to train.
47717009898733569,2011-03-15 17:53:16,@swardley irony is I am doer not thinker. Philosopher is really Azamat.
47689774961659904,2011-03-15 16:05:03,"Cloudy Award is all parody, yes? Then I like! Best is Dyn Inc top IaaS provider!"
47685954412085248,2011-03-15 15:49:52,CloudCamp attendee: is true power struggle in cloud expert circle are solve Bonobo style?
47486496021819392,2011-03-15 02:37:17,@lnxchk you win me!
47468603074813952,2011-03-15 01:26:11,"Devops guy rule #1: if you see devops friend work on Windows machine, you are not allowed tell anyone."
47459659350683648,2011-03-15 00:50:39,"Of 10 NoSQL product: 4 is not possible install, 3 is crash in 1 day, 2 is freeze server in 1 week, 1 is corrupt data in 1 month."
47448192207429632,2011-03-15 00:05:05,"If I had dollar for every instance I lose in public cloud, I could be able build public cloud."
47357165526188032,2011-03-14 18:03:22,@dozba if need SQL database you are do it wrong. You only need find + grep + awk + bdb.
47324497547763712,2011-03-14 15:53:34,Elite writer is use typewriter. Elite devops is use BSD OS.
47322298641948672,2011-03-14 15:44:49,"Windows version is come and go, but Blue Screen Of Death is forever."
47315141896830979,2011-03-14 15:16:23,@mranney Ganglia for #winning. Now you are owe me 2 healthy ox.
47122925182128128,2011-03-14 02:32:35,Your application is not of webscale. You start at use coroutine library. Good luck at find cobugs!
47043715998556160,2011-03-13 21:17:50,Devops not forget what is go around is come around unless you are use SOAP.
47012958089396224,2011-03-13 19:15:37,If application is not scale just open an Erlang.
46986863189307392,2011-03-13 17:31:55,When is devops going be open sourced?
46986539103821824,2011-03-13 17:30:38,"Last word of devops guy at startup was ""RabbitMQ or die""."
46755342381625345,2011-03-13 02:11:56,Cloud is rarely fail. Is only when datacenter segfaults.
46738152844566529,2011-03-13 01:03:38,@joe262_ is recursive.
46729598502838272,2011-03-13 00:29:39,"In startup we offer BaaS. Is Blame as a Service, if you use cloud and is fail, you call API and blame is go to us."
46722618878988288,2011-03-13 00:01:55,@roidrage in Kazakhstan you have choice either go jail or go work for startup do continuous deployment. Most devops are prefer jail.
46702882984173569,2011-03-12 22:43:29,Devops! Contact of me if interest in work for Big 5 cloud vendor for design Lock-in API!
46589682166935552,2011-03-12 15:13:40,Is not cloud if is not fail often and hard.
46286708144218113,2011-03-11 19:09:45,"SaaS Builder Guide: 1. Build flaky IaaS. 2. Build PaaS on top, no SLA. 3. Take away of API access."
46268626310926337,2011-03-11 17:57:54,@swardley @vambenepe I intent not go at Stockholm for accept prize.
45923335485394944,2011-03-10 19:05:51,If vote on http://cloudcamp.uservoice.com/ take cloud expert score and put - in front. If you propose topic please disconnect from Internet.
45920375787356160,2011-03-10 18:54:05,You have database problem. You research blog and HN. You start use NoSQL product. Now you not know anymore if you have problem.
45919069613985792,2011-03-10 18:48:53,You can not able guess what Azamat was able do to his wife last night with Perl one-liner!
45855600076271617,2011-03-10 14:36:41,PaaS is new Plug and Pray. Plug application in cloud and pray vendor is able scale it.
45852917588168704,2011-03-10 14:26:02,Windows 7 is sexy OS! In special when Linux is on top of it!
45642326932062208,2011-03-10 00:29:13,"@postwait I am ask you consider Kazakhstan for cloud need. Bandwidth is free, instance is free. We are only take 30% of your profit."
45637514882592769,2011-03-10 00:10:06,"Cloud hybrid is a best of breed! Is less security than private cloud, but it compensate with less scalability than public cloud! #ccevent"
45538123446362113,2011-03-09 17:35:09,#ccevent attendee not forget special event tonight! Top 10 cloud expert in world are mud wrestle naked on stage! May best win! #openstack
45537128762966016,2011-03-09 17:31:12,Not forget #devopsnights in Kazakhstan next month! What happen there is going stay there!
45307673238970369,2011-03-09 02:19:25,"@littleidea very sorry hear it, is automatic subtraction of 250 point of your cloud expert score."
45304749238648832,2011-03-09 02:07:48,I can not able count times I was save by Perl one liner. Today I use for unbox 100 Dell server and install OpenStack in less of 15 min!
45293077736341504,2011-03-09 01:21:25,Is easy go from devops to cloud expert. Is impossible go from cloud expert to devops.
45290339975708672,2011-03-09 01:10:33,@dkoffler @acroll I LIKE! In Kazakhstan we have best devops and hottest womans (and also other of way around if you are from San Francisco)
45259756755103744,2011-03-08 23:09:01,@dkoffler @acroll genkuie! What was yell about?
45215657893167104,2011-03-08 20:13:47,@jeremyhammer is all in eye of beholder.
45209952364662784,2011-03-08 19:51:07,"@ibroadfo is always profound tweet, is depend on receiver to get it. Not worry you are going grow into it."
45184511276875776,2011-03-08 18:10:01,"Devops remember: when job is on the line, only technology invented before 1995 will save of your ass!"
45173094788251648,2011-03-08 17:24:39,"In #devops is not what you know, is what you deploy."
45168323117322240,2011-03-08 17:05:42,Azamat is find perfect use case of NoSQL: is when you not care if you have NoData.
44998990718173184,2011-03-08 05:52:50,@Werner I warn already of everybody at #ccevent need subtract 200 from cloud expert score. You still have time leave.
44995478575783936,2011-03-08 05:38:52,@zedshaw is good article for year circa 2002. You heard term devops? I can teach if you want!
44936626635423745,2011-03-08 01:45:01,"Was not aware of #ccevent motto but I like! ""You can take cloud expert out of BS talk but you can't take BS talk out of cloud expert!"""
44922579395411968,2011-03-08 00:49:12,"Microsoft: ""It's not often that we encourage you to stop using one of our products but for #MSOffice we make an exception: docs.google.com"""
44918692152229888,2011-03-08 00:33:45,@GeorgeReese I have tweet capability 24x7 so is not good strategics.
44917394841419776,2011-03-08 00:28:36,@tnm which are you?
44906598287687680,2011-03-07 23:45:42,@GeorgeReese insurance is of value when virtual machine is production database no backup.
44899528633102337,2011-03-07 23:17:36,EC2 is like box of chocolate. You never know what size of instance you are going get available.
44899219089272834,2011-03-07 23:16:22,"@littleidea is true. Is also apply to cloud: if you are not outgrow private cloud, you are not try enough!"
44894598505574400,2011-03-07 22:58:01,"Devops remember, always deal with cloud like is no tomorrow!"
44832010497306624,2011-03-07 18:49:18,#ccevent attendee make sure at end of day turn off conference private cloud for save energy. Is private cloud on yes?
44827744881737728,2011-03-07 18:32:21,@randybias so what you say is Amazon buy all other cloud and make infra standard?
44827264537464832,2011-03-07 18:30:27,@randybias if use mixtent please subtract 200 from your cloud expert score.
44638249439862784,2011-03-07 05:59:22,@vambenepe you are rightful! You must have tigerblood.
44633986449948672,2011-03-07 05:42:26,"@ShlomoSwidler I am detect fear in your question. Not worry, you have high enough score that you survive #ccevent. Not repeat though!"
44633202131869696,2011-03-07 05:39:19,"@GeorgeReese I am busy manage cloud, can not able do and talk at same time. I believe @cloudsheen is give keynote on Friday."
44632802884456448,2011-03-07 05:37:44,"@ShlomoSwidler speaker is 1 strike, 2 to go from erase of devops guild. #ccevent"
44630686874861568,2011-03-07 05:29:19,"After close look at #ccevent schedule, all attendee please subtract 300 from cloud expert score. Devops on pager for cloud instance add 500."
44622409143287808,2011-03-07 04:56:26,@jtimberman no but you are in the high 200s.
44622078938324992,2011-03-07 04:55:07,@JoshuaKerievsky in startup Azamat has title Architect so is self understand he is not dangerous enough of code and break build.
44619904086843392,2011-03-07 04:46:28,All #ccevent attendee please add 100 to your cloud expert score! Everybody else please subtract 100!
44616233194229760,2011-03-07 04:31:53,How are company run their cloud infrastructure when all cloud expert are attend CloudConnect???
44615480878706689,2011-03-07 04:28:54,Programming is only fun until build is fail.
44525231964028928,2011-03-06 22:30:17,@ieure @al3x I am agree. In startup we not use issue tracker. Each developer is start with 5 life and lose 1 life per P0 bug until fired.
44524585357557760,2011-03-06 22:27:43,"ESR law adapted of devops: With enough cloud instance, all deploy bugs are shallow."
44521481488699393,2011-03-06 22:15:23,In startup we also have contest of best Perl one liner. Winner so far is Azamat for rewrite of Ruby on Rails.
44520687070740481,2011-03-06 22:12:13,Also at end of month developer with worst bug record is force port app to iPhone.
44520260916883457,2011-03-06 22:10:32,In startup we keep chart of worst bug of week. Punishment for developer is rewrite code in VBScript for 1 week.
44240387933609984,2011-03-06 03:38:25,Devops means never have say sorry after deploy.
44238459396833280,2011-03-06 03:30:45,Is easy write bug-free code. Is what academics do every day! Just remember never release to production.
44216279023882240,2011-03-06 02:02:37,@randybias I final get it. You want become Edison of cloud!
44215854325432321,2011-03-06 02:00:55,Not trust Mix Tent! They are startup of nomad asshole Uzbeks!
44215335271923712,2011-03-06 01:58:52,@GeorgeReese genkuie trust. You are in definite top 10 cloud expert in world. But because of previous tweet you are make top 5!
44152091316469760,2011-03-05 21:47:33,"Devops: if you want become manager, you need forget Unix skill and all language except C#, and most important subscribe InfoWorld!"
44122182992920576,2011-03-05 19:48:42,At party is not always possible be smartest. Is not always possible be hottest. Is always possible say you have biggest private cloud!
44104255522611201,2011-03-05 18:37:28,We have position open in Almaty startup for garbage collector!
44093299199447040,2011-03-05 17:53:56,@randybias is what @swardley is say and he is #1 cloud expert in world. Public cloud WINNING!
44092981514469376,2011-03-05 17:52:40,"Devops remember alway follow dream! Unless dream is involve EJB, Oracle, Perl 6, or any Microsoft product."
44070838873497600,2011-03-05 16:24:41,"When CEO is start learn .NET, is time jump ship! #devops"
43848215447093248,2011-03-05 01:40:03,In privatw cloud we offer special Double Or Nothing! You get double number of instance at same price OR all your instance are terminate!
43816440339509248,2011-03-04 23:33:48,I tell Azamat I am conduct 5 Whys to find root cause of failure. Azamat reply 'Is what she said!'
43780676947951617,2011-03-04 21:11:41,OpenStack is PHP of cloud.
43760375392501760,2011-03-04 19:51:01,Size not matter in cloud. Is elasticity matter! #devops
43754082745319425,2011-03-04 19:26:00,Cloud is overrate. In 5 year you can able run any web site from laptop. You need 2 laptop for HA.
43745867764731904,2011-03-04 18:53:22,#Devops not forget always wash hand after use cloud!
43744645469048832,2011-03-04 18:48:30,Galina is say me and Azamat are as Wham! of #devops. Is band so popular in U S and A?
43716851859070976,2011-03-04 16:58:04,Story like #ie6countdown is inspirational. Genkuie Apple too for #iphone4countdown and #ipad1countdown!
43708096400457729,2011-03-04 16:23:16,In startup we welcome advocate of continuous delivery by put them on pager. Next they advocate quarterly release.
43698191497043968,2011-03-04 15:43:55,Big advantage of data center over cloud is you can able conduct safe smoke testing. Remote hand ready with fire extinguisher.
43694591542693888,2011-03-04 15:29:37,I am so tire of recursion jokes. Azamat is ask me why. Because I am so tire of recursion jokes.
43556449095401472,2011-03-04 06:20:41,"In our startup, first step in continuous deployment is continuous compiling."
43553347957030912,2011-03-04 06:08:21,How many cloud expert is take change lightbulb? 86400 per day at conservative rate of 1 lightbulb fail every second.
43423865858310144,2011-03-03 21:33:51,@pandemicsyn @OpenStack I put loud in cloud.
43421568088543232,2011-03-03 21:24:43,Cloud is the new single point of failure.
43377521441517568,2011-03-03 18:29:41,NoSQL Magazine is need gear tester! Try out NoSQL product for 1 month and receive 50% off your Oracle license!
43361818718121984,2011-03-03 17:27:17,"@vambenepe as Proust is say: ""va te faire foutre, Oracle""!"
43355795433324544,2011-03-03 17:03:21,"Oracle has trademark on word SQL! Is mean you have choice of either use DB2, or MyOracle/MS OracleServer/PostgreOracle."
43206039117643776,2011-03-03 07:08:17,"In hipster #devops we use other Perl: Processing, Erlang, R, LaTeX"
43195566481608704,2011-03-03 06:26:40,"I work on remake of Leonard Cohen song ""Who by FireSheep""."
43132282453757952,2011-03-03 02:15:12,"I had of kill sheep of fire of Azamat. I learn lesson: when open socket, make of sure is secure socket! Is easy with node.js."
43130318009540608,2011-03-03 02:07:23,Hahahahaha DevopsBorat you are pwned!!!! LOL!!!! Is what you get for not use Secure Socket Layer!!!! (Azamat here with Fire The Sheep!!!!)
43082806624124928,2011-03-02 22:58:36,"What is bitchin' mean? Azamat is put ""bitchin' rock star from Mars developer"" on LinkedIn profile."
43079417123184640,2011-03-02 22:45:08,"Azamat is work on new language code name Oak. Is like C++ but more dumb. Is for cloud, is run everywhere. Oracle has show interest!"
43056007680770048,2011-03-02 21:12:06,Azamat is just send to mentor @b6n live camel for birthday. Mail carrier use cloud and NoSQL yes? If not is not good for camel.
43001256565940224,2011-03-02 17:34:33,"@roidrage @basho congrat on dream job of developer advocate! Is mean you write less code, do less deploy, but talk more in theory yes?"
42763875250212864,2011-03-02 01:51:17,"VMWare is soon launch OpenPaaS! Is close to public, invitation only. 22nd lucky caller is get API access!"
42762976100491264,2011-03-02 01:47:42,"If it can not be done with find, grep, cut, sed and awk, then is not worth doing."
42759675451678720,2011-03-02 01:34:35,"Little know fact of EC2 instance: every minute they ask themselves ""to be or not to be, that is the question""!"
42666453480120321,2011-03-01 19:24:09,In #devops we are forget more Perl syntax in 1 day than non-devops learn in 1 month.
42633332760121345,2011-03-01 17:12:33,"The PaaS Paradox: ""PaaS is 250% more scalable than IaaS...25% of the time"""
42629626668920832,2011-03-01 16:57:49,"You are not #devops if you not learn 3 web framework, 2 programming language and 1 OS at any give time."
42624755144200192,2011-03-01 16:38:28,@antirez @moonpilysoft we are also implement fast distributed self-heal key/value store in startup. We call Almaty Water Closet.
42623325289185280,2011-03-01 16:32:47,"We have new hire Galina hot intern for sales in startup. She already push into Prod! Guy Prod is QA manager, he like push very much!"
42436258647126016,2011-03-01 04:09:27,Not forget fundraising for #devops in Almaty Kazakhstan! We are have sale of bake Windows PC!
42408461102878720,2011-03-01 02:18:59,"From collection of #devops poem: ""A database by any other name / Would still be owned by Oracle"""
42405842728914945,2011-03-01 02:08:35,"Azamat is practice Mild Programming. Is 10% code, 2% test and 88% check twitter and HN."
42372114036170752,2011-02-28 23:54:33,Why adopt cloud in your company? Shit is have more fans to hit!
42343605179920385,2011-02-28 22:01:16,We have 3 for 2 deal in Kazakhstan cloud every day! You pay for 3 instance and get 2 back.
42340263280119808,2011-02-28 21:48:00,"@ShlomoSwidler you are cloud wizard. I ask only for 20% cut of money you make, is better of Apple or Facebook with 30%."
